[
  {
    "source": "redfin_county",
    "source_url": "https://www.redfin.com/county/464/FL/Hillsborough-County/foreclosures",
    "captured_at_utc": "2026-02-12T03:06:06.084363+00:00",
    "case_number": "292025CA002108A001HC",
    "folio": "2031312VU000001000030U",
    "http_status": 403,
    "result_status": "error",
    "failure_reason": "http 403",
    "final_url": "https://www.redfin.com/county/464/FL/Hillsborough-County/foreclosures",
    "page_title": "ERROR: The request could not be satisfied",
    "elapsed_sec": 11.391,
    "page_html_path": "logs/market_bakeoff/20260211_220556/redfin_county/292025CA002108A001HC_2031312vu000001000030u.html",
    "page_text_path": "logs/market_bakeoff/20260211_220556/redfin_county/292025CA002108A001HC_2031312vu000001000030u.txt",
    "debugger_network_path": "logs/market_bakeoff/20260211_220556/redfin_county/292025CA002108A001HC_2031312vu000001000030u_network.json",
    "debugger_console_path": "logs/market_bakeoff/20260211_220556/redfin_county/292025CA002108A001HC_2031312vu000001000030u_console.json",
    "photos_count_expected": 0,
    "photo_urls_raw": [],
    "photo_urls_normalized": [],
    "photo_urls_high_res": [],
    "primary_photo_url": null,
    "photo_order": [],
    "photo_capture_success_rate": 0.0,
    "photo_missing_flag": false,
    "photo_hashes": [],
    "gallery_source": "img_tag_scan",
    "address": "606 WINTERBROOKE WAY",
    "city": "SUN CITY CENTER",
    "state": "FL",
    "zip_code": "33573",
    "parcel_number": "2031312VU000001000030U",
    "property_type": null,
    "property_sub_type": null,
    "beds": null,
    "baths_full": null,
    "baths_half": null,
    "baths_total": null,
    "living_area_sqft": null,
    "lot_size_sqft": null,
    "year_built": null,
    "list_price": null,
    "listing_id": null,
    "listing_status": null,
    "on_market_date": null,
    "latitude": null,
    "longitude": null,
    "hoa_fee": null,
    "tax_annual_amount": null,
    "tax_year": null
  }
]